run_id	commit	config	backend	dice	dice_std	iou	pixacc	vram_gb	minutes	status	wandb	description
20260925-1de4ab8-s01-base	1de4ab8	configs/01-swin-t-base.yaml	kaggle	0.9178	0.0049	0.8560	0.9786	5.74	90	keep	https://wandb.ai/lkx100-kl-university/nucseg/runs/4infdvw8	Spec 01 arm A, Swin-T U-Net baseline, no NSL; pooled dice 0.9378, FGSM-2/255 dice 0.800
20260925-d981a3d-s01-nsl	d981a3d	configs/01-swin-t-nsl.yaml	kaggle	0.9144	0.0047	0.8514	0.9775	6.51	215	discard	https://wandb.ai/lkx100-kl-university/nucseg/runs/7wsd4jcw	Spec 01 arm B, NSL adversarial alpha=0.2 eps=2/255; clean dice -0.34 pts vs A on all 5 folds, FGSM-2/255 dice 0.918 (A: 0.800)
20260925-b3fe577-s02-base	b3fe577	configs/02-base.yaml	kaggle	0.9143	0.0068	0.8502	0.9777	5.60	96	keep	https://wandb.ai/lkx100-kl-university/nucseg/runs/lhisoglc	Spec 02 arm A-prime, rerun of spec 01 baseline; TTA dice 0.9155; fold 1 stopped at epoch 18 (best 8), -1.15 pts vs spec 01 arm A
20260925-b3fe577-s02-hires	b3fe577	configs/02-hires.yaml	kaggle	0.9196	0.0088	0.8588	0.9785	6.10	100	keep	https://wandb.ai/lkx100-kl-university/nucseg/runs/upunl7tf	Spec 02 arm C, full-res conv skip; +0.53 pts vs A-prime, 4/5 folds; TTA dice 0.9211; small fluorescence 0.9138 -> 0.9214
20260925-cf38771-s02-scale2	cf38771	configs/02-scale2.yaml	kaggle	0.9190	0.0082	0.8579	0.9788	13.74	285	discard	https://wandb.ai/lkx100-kl-university/nucseg/runs/jhttdsiu	Spec 02 arm D, 2x input scale; +0.47 pts vs A-prime (just under the 0.5 bar), 4/5 folds; TTA dice 0.9197; 2.85x the time of C
20260928-a6250b2-s04-hires-aug	a6250b2	configs/04-hires-aug.yaml	kaggle	0.9213	0.0059	0.8608	0.9788	6.10	123	discard	https://wandb.ai/lkx100-kl-university/nucseg/runs/fsb1e429	Spec 04 arm F, arm C plus strong augmentation (elastic, hue/saturation, gamma, blur, noise); +0.16 pts vs C, 3/5 folds, fails win rule; TTA dice 0.9227 (best so far); H&E unchanged 0.889; FGSM dice 0.833
20260928-f8051ad-s03-hires-nsl1	f8051ad	configs/03-hires-nsl1.yaml	kaggle	0.9197	0.0076	0.8593	0.9785	6.81	227	discard	https://wandb.ai/lkx100-kl-university/nucseg/runs/dskao9dh	Spec 03 arm E, arm C plus NSL alpha=0.2 eps=1/255; +0.01 pts vs C, 3/5 folds, no win; TTA dice 0.9212; FGSM-2/255 dice 0.905 (C: 0.818); 2.3x the time of C
20260929-e7415b1-s05-hires-scale2	e7415b1	configs/05-hires-scale2.yaml	kaggle	0.9196	0.0109	0.8588	0.9783	15.20	343	discard	https://wandb.ai/lkx100-kl-university/nucseg/runs/xqauy837	Spec 05 arm G, arm C at 2x input scale, batch 16; +0.00 pts vs C, 4/5 folds, fails win rule; fold 0 stopped at epoch 13 (best 3, -1.33 pts), other folds +0.33 on average; TTA dice 0.9206; brightfield 0.908, H&E 0.892; 3.4x the time of C
